{"adapter":{"id":"test-adapter","profile":"test-profile","version":"1.0.0"},"bridge_nonce":"ccccccccccccccccccccccccccccccccccccccccccc","capabilities":["read.inventory/v1","read.exact_geometry/v1"],"challenge":"bbbbbbbbbbbbbbbbbbbbbbbbbbbbbbbbbbbbbbbbbbb","challenge_response":"7ff074f9c408b86bcb729d781f27b9e66ecec6566703ca03e62f476b26255194","client_nonce":"aaaaaaaaaaaaaaaaaaaaaaaaaaaaaaaaaaaaaaaaaaa","created_at":"2030-01-01T00:00:00Z","current_document":{"byte_size":128,"database_instance_fingerprint":"3549b0028b75d981cdda2e573e9cb49dedc200185876df299f912b79f69dabd8","dwg_header_signature":"AC1032","file_identity_fingerprint":"689f6a627384c7dcb2dcc1487e540223e77bdf9dcd0d8be8a326eda65b0ce9a4","path_fingerprint":"a0af9f865bf637e6736817f4ce552e4cdf7b8c36ea75bc254c1d1f0af744b5bf","revision_fingerprint":"2b214ddf3326016519afcb268f63623b80b91a65265277668e4d020d87dd9078","saved":true,"sha256":"41cf6794ba4200b839c53531555f0f3998df4cbb01a4d5cb0b94e3ca5e23947d"},"expires_at":"2030-01-01T00:05:00Z","host":{"mode":"full_host","product":"external-host","release":"1.0","runtime":"test-runtime"},"integrity":{"algorithm":"SHA-256","sha256":"8d60bc4ca762fd35f77e5a6668b73cb196fdca58af2d4415c9b72074c3944cb6"},"mode":"read_only","pid":1234,"pipe_name":"\\\\.\\pipe\\liang-pingfa-native-a1b2c3d4e5f6g7h8","plugin":{"fingerprint":"bb2b5d56f0c113ac2fd57cf5ee7a7fbc39820dc24d4a04d25d5020017999b06c","id":"test-plugin","version":"1.0.0"},"process":{"creation_time_100ns":"123456789","executable_fingerprint":"0d3917d207eee802aa7ba4e352eb8b3990d36cc19cd8753bff2685d8e5595c10","instance_fingerprint":"19ed40bf62c399b8492efda5b9a9184b68cf4d9d4a165b38557b9d14201d0c03"},"schema_version":"liang-pingfa/native-bridge-session/v1","session_id":"native-session-0123456789abcdef0123456789abcdef","windows_session_id":1}
